{
  "$schema": "https://json-schema.org/draft/2020-12/schema",
  "$id": "https://example.org/schemas/module-candidate.schema.json",
  "title": "Module Candidate",
  "type": "object",
  "additionalProperties": false,
  "required": [
    "id",
    "source_requirement_id",
    "name",
    "module_category",
    "confidence",
    "rationale",
    "inputs",
    "outputs",
    "reuse_candidate",
    "risk_level",
    "risk_signals",
    "status",
    "missing_information"
  ],
  "properties": {
    "id": {
      "type": "string",
      "pattern": "^mod-[a-z0-9-]+$",
      "examples": ["mod-001"]
    },
    "source_requirement_id": {
      "type": "string",
      "pattern": "^req-[a-z0-9-]+$"
    },
    "catalog_entry_id": {
      "anyOf": [{ "type": "string", "minLength": 1 }, { "type": "null" }]
    },
    "name": {
      "type": "string",
      "minLength": 1
    },
    "module_category": {
      "$ref": "#/$defs/moduleCategory"
    },
    "agent_kind": {
      "anyOf": [{ "$ref": "#/$defs/agentKind" }, { "type": "null" }]
    },
    "workflow_kind": {
      "anyOf": [{ "$ref": "#/$defs/workflowKind" }, { "type": "null" }]
    },
    "adapter_kind": {
      "anyOf": [{ "$ref": "#/$defs/adapterKind" }, { "type": "null" }]
    },
    "remote_contract_kind": {
      "anyOf": [{ "$ref": "#/$defs/remoteContractKind" }, { "type": "null" }]
    },
    "access_protocol": {
      "anyOf": [{ "$ref": "#/$defs/accessProtocol" }, { "type": "null" }]
    },
    "mcp_server": {
      "type": "string",
      "minLength": 1
    },
    "mcp_tool_name": {
      "type": "string",
      "minLength": 1
    },
    "mcp_schema_ref": {
      "type": "string",
      "minLength": 1
    },
    "mcp_auth_mode": {
      "type": "string",
      "minLength": 1
    },
    "legacy_recommended_type": {
      "type": "string",
      "description": "Optional migration metadata for artifacts emitted before module_category became primary."
    },
    "confidence": {
      "type": "number",
      "minimum": 0,
      "maximum": 1
    },
    "rationale": {
      "type": "string",
      "minLength": 1
    },
    "adk_hints": {
      "anyOf": [
        {
          "type": "object",
          "additionalProperties": false,
          "properties": {
            "state_memory": { "$ref": "#/$defs/nullableHintString" },
            "callbacks": { "$ref": "#/$defs/nullableHintString" },
            "artifacts_events": { "$ref": "#/$defs/nullableHintString" },
            "mcp_a2a": { "$ref": "#/$defs/nullableHintString" },
            "streaming_grounding": { "$ref": "#/$defs/nullableHintString" }
          }
        },
        { "type": "null" }
      ]
    },
    "inputs": {
      "type": "array",
      "items": {
        "$ref": "#/$defs/field"
      }
    },
    "outputs": {
      "type": "array",
      "items": {
        "$ref": "#/$defs/field"
      }
    },
    "reuse_candidate": {
      "type": "boolean"
    },
    "risk_level": {
      "type": "string",
      "enum": ["low", "medium", "high"]
    },
    "status": {
      "type": "string",
      "enum": ["needs_info", "approved", "deferred", "rejected"]
    },
    "missing_information": {
      "type": "array",
      "items": {
        "type": "string",
        "minLength": 1
      }
    },
    "missing_information_resolution": {
      "type": "string"
    },
    "resolved_missing_information": {
      "type": "array",
      "items": {
        "type": "string",
        "minLength": 1
      }
    },
    "risk_signals": {
      "type": "array",
      "items": {
        "$ref": "#/$defs/riskSignal"
      }
    },
    "side_effect": {
      "$ref": "#/$defs/sideEffect"
    },
    "auth_required": {
      "type": "boolean"
    },
    "audit_required": {
      "type": "boolean"
    },
    "citation_required": {
      "type": "boolean"
    },
    "grounding_required": {
      "type": "boolean"
    },
    "source_acl_required": {
      "type": "boolean"
    },
    "versioned": {
      "type": "boolean"
    },
    "effective_date_required": {
      "type": "boolean"
    },
    "owner_domain": {
      "type": "string",
      "minLength": 1
    },
    "owner": {
      "type": "string",
      "minLength": 1
    },
    "agent_card": {
      "type": "string",
      "minLength": 1
    },
    "auth": {
      "type": "string",
      "minLength": 1
    },
    "task_lifecycle": {
      "type": "string",
      "minLength": 1
    },
    "timeout": {
      "type": "string",
      "minLength": 1
    },
    "retry": {
      "type": "string",
      "minLength": 1
    },
    "fallback": {
      "type": "string",
      "minLength": 1
    },
    "audit": {
      "type": "string",
      "minLength": 1
    },
    "data_policy": {
      "type": "string",
      "minLength": 1
    },
    "a2a_contract_id": {
      "anyOf": [
        { "type": "string", "pattern": "^a2a-\\d{3,}$" },
        { "type": "null" }
      ],
      "description": "1:1 link to an A2AContract by contract_id; required for remote_a2a candidates."
    }
  },
  "allOf": [
    {
      "if": {
        "properties": {
          "module_category": { "const": "agent" }
        },
        "required": ["module_category"]
      },
      "then": {
        "required": ["agent_kind"]
      }
    },
    {
      "if": {
        "properties": {
          "module_category": { "const": "workflow" }
        },
        "required": ["module_category"]
      },
      "then": {
        "required": ["workflow_kind"]
      }
    },
    {
      "if": {
        "properties": {
          "module_category": { "const": "adapter" }
        },
        "required": ["module_category"]
      },
      "then": {
        "required": ["adapter_kind"]
      }
    },
    {
      "if": {
        "properties": {
          "module_category": { "const": "remote_a2a" }
        },
        "required": ["module_category"]
      },
      "then": {
        "required": [
          "remote_contract_kind",
          "owner",
          "agent_card",
          "auth",
          "task_lifecycle",
          "timeout",
          "retry",
          "fallback",
          "audit",
          "data_policy",
          "a2a_contract_id"
        ],
        "properties": {
          "risk_level": { "const": "high" },
          "a2a_contract_id": {
            "type": "string",
            "pattern": "^a2a-\\d{3,}$"
          }
        }
      }
    },
    {
      "if": {
        "properties": {
          "access_protocol": { "const": "mcp" }
        },
        "required": ["access_protocol"]
      },
      "then": {
        "required": ["mcp_server", "mcp_tool_name"]
      }
    }
  ],
  "$defs": {
    "nullableHintString": {
      "anyOf": [{ "type": "string", "minLength": 1 }, { "type": "null" }]
    },
    "moduleCategory": {
      "type": "string",
      "enum": ["agent", "workflow", "adapter", "remote_a2a"]
    },
    "agentKind": {
      "type": "string",
      "enum": ["specialist", "shared"]
    },
    "workflowKind": {
      "type": "string",
      "enum": ["orchestration", "graph", "dynamic", "unknown"]
    },
    "adapterKind": {
      "type": "string",
      "enum": [
        "legacy_api",
        "retrieval",
        "rule_registry",
        "data_query",
        "template",
        "computation",
        "external_service",
        "unknown"
      ]
    },
    "remoteContractKind": {
      "type": "string",
      "enum": ["a2a", "unknown"]
    },
    "accessProtocol": {
      "type": "string",
      "enum": ["local", "http_rest", "mcp", "grpc", "message_queue", "unknown"]
    },
    "sideEffect": {
      "type": "string",
      "enum": ["none", "read", "write", "read_write", "unknown"]
    },
    "riskSignal": {
      "type": "string",
      "enum": [
        "personal_data",
        "financial_data",
        "credit_decision_support",
        "customer_impact",
        "external_message",
        "transaction_write",
        "human_approval_required",
        "audit_required"
      ]
    },
    "field": {
      "type": "object",
      "additionalProperties": false,
      "required": ["name", "type"],
      "properties": {
        "name": {
          "type": "string",
          "minLength": 1
        },
        "type": {
          "type": "string",
          "minLength": 1
        },
        "required": {
          "type": "boolean",
          "default": false
        }
      }
    }
  },
  "examples": [
    {
      "id": "mod-001",
      "source_requirement_id": "req-001",
      "name": "customer_profile_lookup",
      "module_category": "adapter",
      "adapter_kind": "legacy_api",
      "legacy_recommended_type": "tool_adapter",
      "confidence": 0.82,
      "rationale": "The module calls an existing profile API through a reviewed contract.",
      "inputs": [{ "name": "customer_id", "type": "string", "required": true }],
      "outputs": [{ "name": "customer_profile", "type": "object" }],
      "reuse_candidate": true,
      "risk_level": "medium",
      "risk_signals": ["personal_data", "financial_data", "audit_required"],
      "status": "needs_info",
      "missing_information": ["reviewed API contract", "auth method", "timeout and retry policy"],
      "side_effect": "read",
      "auth_required": true,
      "audit_required": true
    },
    {
      "id": "mod-002",
      "source_requirement_id": "req-001",
      "name": "guidance_retrieval",
      "module_category": "adapter",
      "adapter_kind": "retrieval",
      "legacy_recommended_type": "knowledge_retrieval",
      "confidence": 0.78,
      "rationale": "The module retrieves grounded policy or FAQ evidence.",
      "inputs": [{ "name": "knowledge_query", "type": "text", "required": true }],
      "outputs": [
        { "name": "guidance_summary", "type": "text" },
        { "name": "citations", "type": "array" }
      ],
      "reuse_candidate": true,
      "risk_level": "medium",
      "risk_signals": ["audit_required"],
      "status": "needs_info",
      "missing_information": ["approved source list", "citation policy", "source access control"],
      "citation_required": true,
      "grounding_required": true,
      "source_acl_required": true
    },
    {
      "id": "mod-003",
      "source_requirement_id": "req-001",
      "name": "routing_rules_registry",
      "module_category": "adapter",
      "adapter_kind": "rule_registry",
      "legacy_recommended_type": "metadata_registry",
      "confidence": 0.72,
      "rationale": "The module exposes managed routing thresholds as a callable capability.",
      "inputs": [{ "name": "classification", "type": "string", "required": true }],
      "outputs": [{ "name": "routing_decision", "type": "object" }],
      "reuse_candidate": true,
      "risk_level": "low",
      "risk_signals": ["audit_required"],
      "status": "needs_info",
      "missing_information": ["registry owner", "versioning rule", "effective date policy"],
      "versioned": true,
      "effective_date_required": true,
      "audit_required": true
    },
    {
      "id": "mod-004",
      "source_requirement_id": "req-001",
      "name": "requirement_review_specialist",
      "module_category": "agent",
      "agent_kind": "specialist",
      "legacy_recommended_type": "specialist_agent",
      "confidence": 0.8,
      "rationale": "The module owns a narrow judgment responsibility.",
      "inputs": [{ "name": "review_context", "type": "object", "required": true }],
      "outputs": [{ "name": "recommendation", "type": "object" }],
      "reuse_candidate": false,
      "risk_level": "medium",
      "risk_signals": ["human_approval_required", "audit_required"],
      "status": "needs_info",
      "missing_information": ["input contract", "evaluation placeholder"]
    },
    {
      "id": "mod-005",
      "source_requirement_id": "req-001",
      "name": "requirement_handling_workflow",
      "module_category": "workflow",
      "workflow_kind": "graph",
      "legacy_recommended_type": "internal_workflow",
      "confidence": 0.76,
      "rationale": "The module coordinates ordered local steps.",
      "inputs": [{ "name": "raw_requirement_text", "type": "text", "required": true }],
      "outputs": [{ "name": "workflow_context", "type": "object" }],
      "reuse_candidate": false,
      "risk_level": "medium",
      "risk_signals": ["human_approval_required", "audit_required"],
      "status": "needs_info",
      "missing_information": ["step order", "handoff contract", "failure or escalation rule"]
    },
    {
      "id": "mod-006",
      "source_requirement_id": "req-001",
      "name": "remote_specialist_contract",
      "module_category": "remote_a2a",
      "remote_contract_kind": "a2a",
      "legacy_recommended_type": "remote_a2a_contract",
      "confidence": 0.7,
      "rationale": "The module represents an independent remote agent boundary.",
      "inputs": [{ "name": "delegated_task", "type": "object", "required": true }],
      "outputs": [{ "name": "remote_agent_result", "type": "object" }],
      "reuse_candidate": false,
      "risk_level": "high",
      "risk_signals": ["human_approval_required", "audit_required"],
      "status": "needs_info",
      "missing_information": [
        "remote owner",
        "agent card or discovery method",
        "auth",
        "task lifecycle",
        "timeout",
        "retry",
        "fallback",
        "audit",
        "data policy"
      ]
    }
  ]
}
