[
  {
    "id": "mod-001",
    "source_requirement_id": "req-001",
    "name": "customer_profile_lookup",
    "module_category": "adapter",
    "adapter_kind": "legacy_api",
    "legacy_recommended_type": "tool_adapter",
    "confidence": 0.82,
    "rationale": "Checking a customer profile is a deterministic system lookup with clear input and output data.",
    "inputs": [
      {
        "name": "customer_id",
        "type": "string",
        "required": true
      }
    ],
    "outputs": [
      {
        "name": "customer_profile",
        "type": "object"
      }
    ],
    "reuse_candidate": true,
    "risk_level": "medium",
    "risk_signals": ["personal_data", "financial_data", "audit_required"],
    "status": "needs_info",
    "missing_information": ["reviewed API contract", "auth method", "timeout and retry policy"],
    "side_effect": "read",
    "auth_required": true,
    "audit_required": true
  },
  {
    "id": "mod-002",
    "source_requirement_id": "req-001",
    "name": "response_guidance_retrieval",
    "module_category": "adapter",
    "adapter_kind": "retrieval",
    "legacy_recommended_type": "knowledge_retrieval",
    "confidence": 0.78,
    "rationale": "Looking up response guidance is a retrieval capability over reusable support knowledge.",
    "inputs": [
      {
        "name": "complaint_text",
        "type": "text",
        "required": true
      }
    ],
    "outputs": [
      {
        "name": "guidance_summary",
        "type": "text"
      },
      {
        "name": "citations",
        "type": "array"
      }
    ],
    "reuse_candidate": true,
    "risk_level": "medium",
    "risk_signals": ["audit_required"],
    "status": "needs_info",
    "missing_information": ["approved source list", "citation policy", "source access control"],
    "citation_required": true,
    "grounding_required": true,
    "source_acl_required": true
  },
  {
    "id": "mod-003",
    "source_requirement_id": "req-001",
    "name": "complaint_triage_workflow",
    "module_category": "workflow",
    "workflow_kind": "graph",
    "legacy_recommended_type": "internal_workflow",
    "confidence": 0.76,
    "rationale": "The request describes ordered steps inside one triage boundary.",
    "inputs": [
      {
        "name": "complaint_text",
        "type": "text",
        "required": true
      },
      {
        "name": "customer_profile",
        "type": "object",
        "required": false
      },
      {
        "name": "guidance_summary",
        "type": "text",
        "required": false
      }
    ],
    "outputs": [
      {
        "name": "triage_context",
        "type": "object"
      }
    ],
    "reuse_candidate": false,
    "risk_level": "medium",
    "risk_signals": ["human_approval_required", "audit_required"],
    "status": "needs_info",
    "missing_information": ["step order", "handoff contract", "failure or escalation rule"]
  },
  {
    "id": "mod-004",
    "source_requirement_id": "req-001",
    "name": "complaint_triage_specialist",
    "module_category": "agent",
    "agent_kind": "specialist",
    "legacy_recommended_type": "specialist_agent",
    "confidence": 0.8,
    "rationale": "The capability combines context, retrieval, and judgment to recommend a next step.",
    "inputs": [
      {
        "name": "triage_context",
        "type": "object",
        "required": true
      }
    ],
    "outputs": [
      {
        "name": "triage_category",
        "type": "string"
      },
      {
        "name": "recommended_next_step",
        "type": "string"
      }
    ],
    "reuse_candidate": false,
    "risk_level": "medium",
    "risk_signals": ["customer_impact", "human_approval_required", "audit_required"],
    "status": "needs_info",
    "missing_information": ["input contract", "eval placeholder"]
  },
  {
    "id": "mod-005",
    "source_requirement_id": "req-001",
    "name": "support_routing_rules",
    "module_category": "adapter",
    "adapter_kind": "rule_registry",
    "legacy_recommended_type": "metadata_registry",
    "confidence": 0.72,
    "rationale": "Reusable priority thresholds and routing rules are structured operating metadata exposed as a callable adapter.",
    "inputs": [
      {
        "name": "triage_category",
        "type": "string",
        "required": true
      }
    ],
    "outputs": [
      {
        "name": "routing_decision",
        "type": "object"
      }
    ],
    "reuse_candidate": true,
    "risk_level": "low",
    "risk_signals": ["audit_required"],
    "status": "needs_info",
    "missing_information": ["registry owner", "versioning rule", "effective date policy"],
    "versioned": true,
    "effective_date_required": true,
    "audit_required": true
  }
]
